{
  "authorizing": false,
  "claim_boundary": "STRUCTURAL_REVIEW_PREPARATION_ONLY_NO_REVIEWER_DECISION_IDENTITY_ROLE_AUTHORITY_INDEPENDENCE_EVIDENCE_AUTHENTICATION_ADR_ACCEPTANCE_TASK_STATUS_PROTOCOL_CHANGE_OR_RELEASE_AUTHORITY",
  "counts": {
    "decisions": 11,
    "independent_obligations": 5,
    "minimum_evidence_requirements": 112,
    "minimum_identity_slots": 53,
    "minimum_independent_identity_slots": 6,
    "role_obligations": 52
  },
  "decisions": [
    {
      "adr_id": "ADR-001",
      "subject": {
        "adr_bytes": 163669,
        "adr_content_sha256": "126daf508c8bc2123ccaf705f0209dd2d341e8598e5ba943c663dcf34d2e9325",
        "adr_source_set": {
          "decision_id": "ADR-001",
          "digest_algorithm": "sha256(domain || u64be(projection_bytes) || projection)",
          "domain_hex": "6e63702e6230312d6164722d736f757263652d7365742e763100",
          "schema": "ncp.b01-adr-source-set.v1",
          "sha256": "a4fef4b32d7984d880d2d64068988505982ec836cb9f22984fce032bd5fae9d0",
          "sources": [
            {
              "bytes": 163669,
              "kind": "main",
              "path": "docs/adr/0001-separate-simulation-and-plant-sessions.md",
              "sha256": "126daf508c8bc2123ccaf705f0209dd2d341e8598e5ba943c663dcf34d2e9325"
            }
          ]
        },
        "decision_set_sha256": "1113dd7ca5a333a3f0a91632b8d8c52f8ac576045f959830434ba74067953bc4",
        "review_packet_sha256": "e9dd33d10fbb0df5e70264dd82c0c6beefb97b7fcd98ced4750e32f742d80c79",
        "source_commit": "adfb064d901cc8ae459dbddd5d7b26cda7ba02c0",
        "source_tree": "21b1e14fe6cb80950d251a68347c4007b67d6410"
      }
    },
    {
      "adr_id": "ADR-002",
      "subject": {
        "adr_bytes": 21943,
        "adr_content_sha256": "e01d2cb2eb6e11bbc78ed3149dae46bbc80243f5202bf5749c26affd4a268689",
        "adr_source_set": {
          "decision_id": "ADR-002",
          "digest_algorithm": "sha256(domain || u64be(projection_bytes) || projection)",
          "domain_hex": "6e63702e6230312d6164722d736f757263652d7365742e763100",
          "schema": "ncp.b01-adr-source-set.v1",
          "sha256": "3a234d7196cc920b809a9abf19765a28ed72e3f2846a40a2dcc9ff3c2aa1a764",
          "sources": [
            {
              "bytes": 21943,
              "kind": "main",
              "path": "docs/adr/0002-contract-identity-and-release-authorization.md",
              "sha256": "e01d2cb2eb6e11bbc78ed3149dae46bbc80243f5202bf5749c26affd4a268689"
            }
          ]
        },
        "decision_set_sha256": "1113dd7ca5a333a3f0a91632b8d8c52f8ac576045f959830434ba74067953bc4",
        "review_packet_sha256": "e9dd33d10fbb0df5e70264dd82c0c6beefb97b7fcd98ced4750e32f742d80c79",
        "source_commit": "adfb064d901cc8ae459dbddd5d7b26cda7ba02c0",
        "source_tree": "21b1e14fe6cb80950d251a68347c4007b67d6410"
      }
    },
    {
      "adr_id": "ADR-003",
      "subject": {
        "adr_bytes": 24082,
        "adr_content_sha256": "08aa3d60d4c050daaa52b5c16d864272bb1c7a48a37e59c5ad1bfea5cfb5fb88",
        "adr_source_set": {
          "decision_id": "ADR-003",
          "digest_algorithm": "sha256(domain || u64be(projection_bytes) || projection)",
          "domain_hex": "6e63702e6230312d6164722d736f757263652d7365742e763100",
          "schema": "ncp.b01-adr-source-set.v1",
          "sha256": "cb9d0948d5e5277a81ca57e3fbaa5d1fc1d8c41441237a3ce8016a314895413a",
          "sources": [
            {
              "bytes": 24082,
              "kind": "main",
              "path": "docs/adr/0003-authenticated-production-ingress.md",
              "sha256": "08aa3d60d4c050daaa52b5c16d864272bb1c7a48a37e59c5ad1bfea5cfb5fb88"
            }
          ]
        },
        "decision_set_sha256": "1113dd7ca5a333a3f0a91632b8d8c52f8ac576045f959830434ba74067953bc4",
        "review_packet_sha256": "e9dd33d10fbb0df5e70264dd82c0c6beefb97b7fcd98ced4750e32f742d80c79",
        "source_commit": "adfb064d901cc8ae459dbddd5d7b26cda7ba02c0",
        "source_tree": "21b1e14fe6cb80950d251a68347c4007b67d6410"
      }
    },
    {
      "adr_id": "ADR-004",
      "subject": {
        "adr_bytes": 262142,
        "adr_content_sha256": "77e0e420665d6b7b2af13be203d84d43b531db897a4b53f70e1021734c0eddfc",
        "adr_source_set": {
          "decision_id": "ADR-004",
          "digest_algorithm": "sha256(domain || u64be(projection_bytes) || projection)",
          "domain_hex": "6e63702e6230312d6164722d736f757263652d7365742e763100",
          "schema": "ncp.b01-adr-source-set.v1",
          "sha256": "d70f1297dffee51a6cfeb2ea8ed03006d06eaf547b45b0eff65d57ec6c4cdc28",
          "sources": [
            {
              "bytes": 262142,
              "kind": "main",
              "path": "docs/adr/0004-observer-attach-grants-and-revocation.md",
              "sha256": "77e0e420665d6b7b2af13be203d84d43b531db897a4b53f70e1021734c0eddfc"
            },
            {
              "bytes": 118688,
              "kind": "module",
              "path": "docs/adr/modules/adr-004-cross-store-observer-closure-and-enrollment.md",
              "sha256": "24c4b431ef1b5add127b832858d2b38539f1ae6e7da30cc53da7cbb706c627ee"
            }
          ]
        },
        "decision_set_sha256": "1113dd7ca5a333a3f0a91632b8d8c52f8ac576045f959830434ba74067953bc4",
        "review_packet_sha256": "e9dd33d10fbb0df5e70264dd82c0c6beefb97b7fcd98ced4750e32f742d80c79",
        "source_commit": "adfb064d901cc8ae459dbddd5d7b26cda7ba02c0",
        "source_tree": "21b1e14fe6cb80950d251a68347c4007b67d6410"
      }
    },
    {
      "adr_id": "ADR-005",
      "subject": {
        "adr_bytes": 45226,
        "adr_content_sha256": "1620292c21142ec153670e039ce24baefb32702998a9262f22b3a13483367356",
        "adr_source_set": {
          "decision_id": "ADR-005",
          "digest_algorithm": "sha256(domain || u64be(projection_bytes) || projection)",
          "domain_hex": "6e63702e6230312d6164722d736f757263652d7365742e763100",
          "schema": "ncp.b01-adr-source-set.v1",
          "sha256": "6705dccd0466c41ff7a62a0047e8b191dd0460679e8aaa1d5df440518b08a4a6",
          "sources": [
            {
              "bytes": 45226,
              "kind": "main",
              "path": "docs/adr/0005-declared-stream-lifecycle.md",
              "sha256": "1620292c21142ec153670e039ce24baefb32702998a9262f22b3a13483367356"
            }
          ]
        },
        "decision_set_sha256": "1113dd7ca5a333a3f0a91632b8d8c52f8ac576045f959830434ba74067953bc4",
        "review_packet_sha256": "e9dd33d10fbb0df5e70264dd82c0c6beefb97b7fcd98ced4750e32f742d80c79",
        "source_commit": "adfb064d901cc8ae459dbddd5d7b26cda7ba02c0",
        "source_tree": "21b1e14fe6cb80950d251a68347c4007b67d6410"
      }
    },
    {
      "adr_id": "ADR-006",
      "subject": {
        "adr_bytes": 59342,
        "adr_content_sha256": "d066e8b83a5422f431e95d071f99c25c84ad2c27b00343f2689378f5e0ea4dd1",
        "adr_source_set": {
          "decision_id": "ADR-006",
          "digest_algorithm": "sha256(domain || u64be(projection_bytes) || projection)",
          "domain_hex": "6e63702e6230312d6164722d736f757263652d7365742e763100",
          "schema": "ncp.b01-adr-source-set.v1",
          "sha256": "8b79bad8223797d5ba2e962817be574ae20e472fad3d5c878db4f0b45bffa407",
          "sources": [
            {
              "bytes": 59342,
              "kind": "main",
              "path": "docs/adr/0006-body-issued-authority-and-time.md",
              "sha256": "d066e8b83a5422f431e95d071f99c25c84ad2c27b00343f2689378f5e0ea4dd1"
            }
          ]
        },
        "decision_set_sha256": "1113dd7ca5a333a3f0a91632b8d8c52f8ac576045f959830434ba74067953bc4",
        "review_packet_sha256": "e9dd33d10fbb0df5e70264dd82c0c6beefb97b7fcd98ced4750e32f742d80c79",
        "source_commit": "adfb064d901cc8ae459dbddd5d7b26cda7ba02c0",
        "source_tree": "21b1e14fe6cb80950d251a68347c4007b67d6410"
      }
    },
    {
      "adr_id": "ADR-007",
      "subject": {
        "adr_bytes": 231553,
        "adr_content_sha256": "57aeafcb3db1ee565797dcaddaeb5f77a231896e2054758702a89307280cc5e7",
        "adr_source_set": {
          "decision_id": "ADR-007",
          "digest_algorithm": "sha256(domain || u64be(projection_bytes) || projection)",
          "domain_hex": "6e63702e6230312d6164722d736f757263652d7365742e763100",
          "schema": "ncp.b01-adr-source-set.v1",
          "sha256": "c9e09aa0fe0cfc588953f773f28191b1364d35dff68c1fc7d20f2a3adb8f0887",
          "sources": [
            {
              "bytes": 231553,
              "kind": "main",
              "path": "docs/adr/0007-command-disposition-journal.md",
              "sha256": "57aeafcb3db1ee565797dcaddaeb5f77a231896e2054758702a89307280cc5e7"
            }
          ]
        },
        "decision_set_sha256": "1113dd7ca5a333a3f0a91632b8d8c52f8ac576045f959830434ba74067953bc4",
        "review_packet_sha256": "e9dd33d10fbb0df5e70264dd82c0c6beefb97b7fcd98ced4750e32f742d80c79",
        "source_commit": "adfb064d901cc8ae459dbddd5d7b26cda7ba02c0",
        "source_tree": "21b1e14fe6cb80950d251a68347c4007b67d6410"
      }
    },
    {
      "adr_id": "ADR-008",
      "subject": {
        "adr_bytes": 182936,
        "adr_content_sha256": "2e01889e4ba266a2b7a1e37612a5225bbd2493b2ae9fa6fe651d78ddba3be2bc",
        "adr_source_set": {
          "decision_id": "ADR-008",
          "digest_algorithm": "sha256(domain || u64be(projection_bytes) || projection)",
          "domain_hex": "6e63702e6230312d6164722d736f757263652d7365742e763100",
          "schema": "ncp.b01-adr-source-set.v1",
          "sha256": "1f3dc5b2396f4156b546ea533f5f171d0a389c5e445bb8f2e76318ff429f2bf9",
          "sources": [
            {
              "bytes": 182936,
              "kind": "main",
              "path": "docs/adr/0008-extension-namespace-and-galadriel-separation.md",
              "sha256": "2e01889e4ba266a2b7a1e37612a5225bbd2493b2ae9fa6fe651d78ddba3be2bc"
            }
          ]